<?xml version="1.0" encoding="UTF-8"?>
<!DOCTYPE anthology SYSTEM "anthology.dtd">
<anthology>
   <poem1>
       <title></title>
       <stanza1>
           <line1></line1>
           <line2></line2>
           <line3></line3>
           <line4></line4>
           <line5></line5>
           <line6></line6>
           <line7></line7>
           <line8></line8>
       </stanza1>
       <stanza2></stanza2>
   </poem1>
   <poem2>
       <title></title>
       <stanza1>
           <line1></line1>
           <line2></line2>
           <line3></line3>
           <line4></line4>
       </stanza1>
   </poem2>
</anthology>